keyword,trend_score,volume,cpc,competition
soft girl aesthetic clothes,0,,,
soft girl aesthetic clothes pinterest,0,,,
soft girl aesthetic clothing stores,0,,,
soft girl aesthetic outfits,0,,,
soft girl aesthetic outfits pinterest,0,,,
soft girl aesthetic dresses,0,,,
soft girl aesthetic fashion,0,,,
soft girl aesthetic outfits for school,0,,,
soft girl aesthetic outfits winter,0,,,
soft girl aesthetic outfits plus size,0,,,
where to buy soft girl aesthetic clothes,0,,,
soft girl aesthetic outfit ideas,0,,,
what is a soft girl aesthetic,0,,,
soft girl aesthetic style,0,,,
soft girl aesthetic images,0,,,
soft girl aesthetic pictures pinterest,0,,,
soft girl aesthetic pic,0,,,
soft girl aesthetic profile pictures,0,,,
soft girl aesthetic names,0,,,
soft girl names aesthetic with meaning,0,,,
soft girl names aesthetic unique,0,,,
cute soft girl names aesthetic,0,,,
other names for soft girl aesthetic,0,,,
soft aesthetic names,0,,,
whats a good name for a soft girl,0,,,
pinterest soft girl aesthetic outfit ideas,0,,,
soft girl outfit ideas,0,,,
soft girl aesthetic photos,0,,,
soft girl aesthetic photoshoot,0,,,
soft girl aesthetic pictures,0,,,
soft girl aesthetic image,0,,,
soft girl aesthetic pics,0,,,
style soft girl aesthetic outfits,0,,,
what is the soft girl aesthetic called,0,,,
what is soft girl era aesthetic,0,,,
what does soft girl aesthetic mean,0,,,
what is the opposite of soft girl aesthetic,0,,,
cute soft girl makeup looks,0,,,
soft girl makeup ideas,0,,,
soft e girl makeup tutorial,0,,,
soft girl makeup tutorial,0,,,
what is e girl makeup,0,,,
what is the e girl aesthetic,0,,,
soft girl makeup easy,0,,,
soft girl makeup looks,0,,,
soft girl makeup tips,0,,,
what is soft girl makeup,0,,,
little girl makeup ideas,0,,,
soft girl makeup look,0,,,
soft girl makeup look step by step,0,,,
soft girl makeup look aesthetic,0,,,
soft girl makeup look pinterest,0,,,
soft girl makeup look tutorial,0,,,
woman soft makeup look,0,,,
black girl soft makeup look,0,,,
how to do a soft girl makeup look,0,,,
soft girl makeup pictures,0,,,
soft girl makeup style,0,,,
what is a vsco girl aesthetic,0,,,
black girl soft glam makeup tutorial,0,,,
soft girl outfit ideas drawing,0,,,
soft girl clothes ideas,0,,,
soft girl outfit inspiration,0,,,
cute soft girl outfit ideas,0,,,
soft girl era outfit ideas,0,,,
gacha club soft girl outfit ideas,0,,,
punk girl outfit ideas,0,,,
soft girl makeup aesthetic,0,,,
soft glam makeup photos,0,,,
soft glam makeup photoshoot,0,,,
soft.glam.makeup aesthetic,0,,,
what is glam aesthetic,0,,,
style soft boy,0,,,
style soft boy outfits,0,,,
soft boy fashion aesthetic,0,,,
soft boy aesthetic fashion,0,,,
fashion aesthetic names,0,,,
fashion aesthetics types,0,,,
fashion aesthetic meaning,0,,,
fashion soft girl,0,,,
clothes soft girl aesthetic,0,,,
soft girl fashion trend,0,,,
soft girl fashion brands,0,,,
soft girl fashion 2024,0,,,
soft girl fashion reddit,0,,,
style soft power,0,,,
photography soft box,0,,,
photography softbox lights,0,,,
product photography soft box,0,,,
dental photography soft box,0,,,
flash photography soft box,0,,,
diy photography soft box,0,,,
car photography soft box,0,,,
best softbox for photography,0,,,
small softbox photography,0,,,
baby photography soft box,0,,,
photography soft focus,0,,,
photo soft focus,0,,,
photo focus soft beige,0,,,
photo focus soft ivory,0,,,
photo focus soft pink,0,,,
iphone photo soft focus,0,,,
soft focus photography definition,0,,,
soft focus photography examples,0,,,
soft focus photography technique,0,,,
what is focus in photography,0,,,
soft focus portrait photography,0,,,
photography focus techniques,0,,,
what does a softbox do in photography,0,,,
what is a softbox in photography,0,,,
soft light photography examples,0,,,
soft aesthetic usernames,0,,,
soft aesthetic,0,,,
soft aesthetic symbols,0,,,
soft aesthetic words,0,,,
soft aesthetic usernames for instagram,0,,,
soft aesthetic usernames generator,0,,,
soft aesthetic ringtones,0,,,
soft aesthetic bios copy and paste,0,,,
soft aesthetic portrait brush pack,0,,,
soft aesthetic photo,0,,,
soft aesthetic picture,0,,,
soft aesthetic meaning,0,,,
soft aesthetic photos,0,,,
soft aesthetic photography,0,,,
soft aesthetic pictures,0,,,
soft aesthetic pic,0,,,
soft aesthetic image,0,,,
soft pink aesthetic photos,0,,,
soft boy aesthetic photos,0,,,
aesthetic soft launch photos,0,,,
what is aesthetic photography,0,,,
soft aesthetic aesthetic dark usernames,0,,,
soft aesthetic short aesthetic usernames,0,,,
soft aesthetic artsy aesthetic usernames for instagram,0,,,
soft aesthetic cd painting aesthetic,0,,,
soft aesthetic background,0,,,
soft aesthetic background music,0,,,
soft aesthetic bios copy and paste for instagram,0,,,
soft aesthetic bio template copy and paste,0,,,
soft aesthetic clothes,0,,,
soft aesthetic clothes men,0,,,
soft aesthetic clothes shop,0,,,
soft aesthetic outfits,0,,,
soft aesthetic outfits male,0,,,
soft aesthetic outfits female,0,,,
soft aesthetic fashion,0,,,
soft aesthetic dress,0,,,
soft aesthetic outfits men,0,,,
soft aesthetic outfits pinterest,0,,,
soft aesthetic names for instagram,0,,,
soft aesthetic names for girls,0,,,
soft aesthetic name generator,0,,,
soft aesthetic list,0,,,
soft aesthetic boy names,0,,,
soft pink aesthetic names,0,,,
soft aesthetic discord server names,0,,,
soft aesthetic outfits girl,0,,,
soft aesthetic outfit ideas,0,,,
soft aesthetic usernames for instagram for girl,0,,,
soft aesthetic usernames for tiktok,0,,,
soft aesthetic usernames for tiktok with your name,0,,,
soft aesthetic usernames with your name,0,,,
soft aesthetic usernames for tiktok for girl,0,,,
soft aesthetic usernames for youtube,0,,,
soft aesthetic usernames generator with your name,0,,,
instagram soft aesthetic short aesthetic usernames,0,,,
aesthetic usernames for instagram generator,0,,,
soft aesthetic words for usernames,0,,,
soft aesthetic words for instagram,0,,,
soft aesthetic words moon usernames for instagram,0,,,
soft girl aesthetic words,0,,,
soft fashion style,0,,,
soft fashion aesthetic,0,,,
soft portrait clothes,0,,,
difference between portrait and fashion photography,0,,,
famous portrait styles,0,,,
portrait vs fashion photography,0,,,
soft style photo,0,,,
soft light fashion photography,0,,,
soft photography style,0,,,
fashion photography captions for instagram,0,,,
fashion photography ideas,0,,,
4 types of fashion photography,0,,,
fashion photography description,0,,,
soft clothing aesthetic,0,,,
soft style aesthetic,0,,,
soft girl fashion aesthetic,0,,,
soft club aesthetic fashion,0,,,
soft style shoes,0,,,
soft style shoes for ladies,0,,,
soft style shoes by hush puppies,0,,,
soft style shoes south africa,0,,,
soft style shoes for ladies in south africa,0,,,
soft style shoes amazon,0,,,
soft style shoes flats,0,,,
soft clothing style,0,,,
soft clothing style male,0,,,
soft clothing style female,0,,,
soft clothing style names,0,,,
soft girl fashion style,0,,,
soft boy fashion style,0,,,
soft natural fashion style,0,,,
soft grunge fashion style,0,,,
coquette soft style fashion,0,,,
soft filter photography,0,,,
soft focus photography,0,,,
soft filter photo,0,,,
soft focus filter photography,0,,,
soft photo filter app,0,,,
soft focus portrait lens,0,,,
what filter to use for portrait photography,0,,,
photography filters explained,0,,,
soft flash photography,0,,,
flash photography ideas,0,,,
what is soft light in photography,0,,,
is flash necessary for photography,0,,,
soft images photography,0,,,
soft images photos,0,,,
photos vs photographs,0,,,
soft lens photography,0,,,
contact lens photography,0,,,
soft lens photo,0,,,
soft focus lens photography,0,,,
soft modeling clay,0,,,
soft model,0,,,
soft model of hrm,0,,,
soft model makeup,0,,,
soft modelling wax,0,,,
soft modelling material crossword clue,0,,,
soft modeling clay for kids,0,,,
soft model aesthetic,0,,,
what makeup do models use,0,,,
hard and soft model of hrm,0,,,
hard and soft models of hrm storey 1989,0,,,
difference between hard and soft model of hrm,0,,,
soft modeling clay recipe,0,,,
smooth modeling clay,0,,,
how to harden children's modeling clay,0,,,
children's modelling clay ideas,0,,,
how to make modeling clay soft fast,0,,,
what is modelling wax,0,,,
modeling wax recipe,0,,,
modelling wax price,0,,,
soft photo album,0,,,
soft photo album for toddlers,0,,,
soft photo album baby,0,,,
soft photo album for baby uk,0,,,
soft photo album kmart,0,,,
soft photo album 4x6,0,,,
soft photo album near me,0,,,
soft photo album target,0,,,
soft photo album for.child,0,,,
soft photo album nearby,0,,,
soft photo album for baby,0,,,
soft photo books for baby,0,,,
soft fabric photo album for baby,0,,,
cloth soft photo album for baby,0,,,
soft book photo album baby,0,,,
baby photo album ideas,0,,,
first year baby photo album ideas,0,,,
soft photo album for babies,0,,,
soft photo album for kids,0,,,
preschool photo album ideas,0,,,
children's photo album ideas,0,,,
soft photo book for baby,0,,,
soft photo book,0,,,
soft photo book for toddler,0,,,
soft photo book for kids,0,,,
soft photo book for baby australia,0,,,
fabric photo book,0,,,
cloth photo book,0,,,
cloth photo book for baby,0,,,
soft cover portrait photo book,0,,,
studio portrait photography ideas,0,,,
photoshoot portrait ideas,0,,,
famous photographers photo books,0,,,
photo books how many photos,0,,,
fabric photo book for baby,0,,,
personalised soft photo book for baby,0,,,
soft photo book baby toy,0,,,
soft photo frame,0,,,
soft photo frame for baby,0,,,
soft photo frame for kids,0,,,
soft toy photo frame,0,,,
soft pink photo frame,0,,,
soft fabric photo frame,0,,,
soft edge photo frame,0,,,
soft photography,0,,,
soft photography lighting,0,,,
soft portrait photography,0,,,
soft light portrait photography,0,,,
portrait photography description,0,,,
famous photography self portraits,0,,,
portrait photography pricing guide,0,,,
photography photo sizes,0,,,
photography aesthetic types,0,,,
soft photo lighting,0,,,
soft lighting photography definition,0,,,
soft lighting photography examples,0,,,
softbox photography lighting,0,,,
soft lighting portrait photography,0,,,
portrait photography lighting techniques,0,,,
what is a soft photo,0,,,
what are some photography styles,0,,,
soft photolithography,0,,,
photolithography soft bake,0,,,
photolithography soft lithography,0,,,
soft lithography vs photolithography,0,,,
types of photolithography,0,,,
soft photon,0,,,
soft photon decoherence two path,0,,,
photon soft step on,0,,,
photon soft tissue diode laser,0,,,
photon soft boot,0,,,
photon soft step on review,0,,,
soft matter photonics,0,,,
weinberg soft photon theorem,0,,,
conformally soft photons and gravitons,0,,,
subleading soft photon theorem,0,,,
soft photos,0,,,
soft photoshop,0,,,
soft photos girl,0,,,
soft photoshop brushes,0,,,
photoshop soft edges,0,,,
photoshop soft proofing,0,,,
photoshop soft light,0,,,
photos soft copy,0,,,
photoshop soft round brush,0,,,
photoshop soft eraser,0,,,
types of portrait photos,0,,,
why are my photos soft,0,,,
personal photography examples,0,,,
can you take a photo of a photo,0,,,
what should i take pictures of for photography,0,,,
soft photo aesthetic,0,,,
soft pictures aesthetic,0,,,
soft aesthetic pics,0,,,
soft aesthetic images,0,,,
soft and natural aesthetics photos,0,,,
soft style,0,,,
soft style t shirt,0,,,
soft style shirt,0,,,
soft style ladies shoes,0,,,
soft style clothing,0,,,
soft style paul mitchell,0,,,
soft style shoes for women,0,,,
soft style sandals,0,,,
soft style cotton,0,,,
soft style heels,0,,,
different portrait styles,0,,,
portrait style meaning,0,,,
what is portrait style,0,,,
photography style examples,0,,,
different photo styles,0,,,
famous photography styles,0,,,
coquette soft style aesthetic,0,,,
soft girl style aesthetic,0,,,
soft boy aesthetic style,0,,,
coquette soft style aesthetic outfits,0,,,
style aesthetic examples,0,,,
soft style clothing male,0,,,
soft clothing style men,0,,,
soft grunge style clothing,0,,,
coquette soft style clothing,0,,,
soft girl style clothing,0,,,
soft boy style clothing,0,,,
soft classic style clothing,0,,,
soft style cotton t shirt,0,,,
soft style cotton shirt,0,,,
gildan soft style cotton,0,,,
mens soft style cotton t shirt,0,,,
does soft style cotton shrink,0,,,
gildan softstyle cotton t-shirt,0,,,
gildan soft style cotton shirts,0,,,
heavy cotton vs softstyle,0,,,
heavy weight vs soft style cotton,0,,,
gildan women's softstyle cotton t shirt style g64000l,0,,,
gildan adult softstyle cotton t shirt style g64000,0,,,
gildan women's softstyle cotton t shirt style g64000l multipack,0,,,
gildan adult softstyle cotton t shirt style g64000 multipack,0,,,
gildan mens softstyle cotton t shirt style g64000,0,,,
soft style gildan color chart,0,,,
gildan soft style shirts color chart,0,,,
gildan 64000 soft style color chart,0,,,
gildan soft style tshirt color chart,0,,,
gildan soft style heather color chart,0,,,
how does gildan soft style fit,0,,,
soft style quick slip paul mitchell,0,,,
soft style fast form paul mitchell,0,,,
soft style soft spray paul mitchell,0,,,
soft style foaming pomade paul mitchell,0,,,
paul mitchell soft style foaming pommade,0,,,
paul mitchell soft style the cream,0,,,
paul mitchell soft style super clean light,0,,,
paul mitchell soft style hair spray,0,,,
paul mitchell soft style fast foam,0,,,
soft style sandals by hush puppies,0,,,
soft style shoes price,0,,,
softstyle shirt colors,0,,,
soft style shirt codycross,0,,,
gildan soft style shirts,0,,,
gildan soft style shirt colors,0,,,
soft style t shirt colors,0,,,
gildan soft style shirts near me,0,,,
soft style t shirt meaning,0,,,
soft style t shirt brands,0,,,
styles of ladies shoes,0,,,
soft style t shirt size chart,0,,,
gildan softstyle t shirt,0,,,
soft style t shirt near me,0,,,
soft style t shirt material,0,,,
soft style tee shirts,0,,,
soft woman era,0,,,
soft woman era meaning,0,,,
soft woman era quotes,0,,,
soft woman era meme,0,,,
soft woman era meaning urban dictionary,0,,,
in my soft woman era,0,,,
woman era soft gel,0,,,
woman era soft gel capsules,0,,,
soft woman meaning,0,,,
what does it mean when a girl is soft,0,,,
iconic girl quotes,0,,,
soft woman meaning urban dictionary,0,,,
soft woman meaning in relationship,0,,,
soft girl meaning,0,,,
soft girl meaning tagalog,0,,,
soft girl meaning in relationship,0,,,
soft girl meaning in hindi,0,,,
soft girl meaning slang,0,,,
soft girl aesthetic meaning,0,,,
soft girl aesthetic meaning in hindi,0,,,
what is a soft girl personality,0,,,
soft woman names,0,,,
soft girl names,0,,,
soft female names,0,,,
soft girl names aesthetic,0,,,
soft girl names japanese,0,,,
soft girl names with meaning,0,,,
soft girl names reddit,0,,,
soft last names for girls,0,,,
soft girl names starting with a,0,,,
name for girl aesthetic,0,,,
soft woman quotes,0,,,
soft girl quotes,0,,,
soft girl quotes for instagram,0,,,
soft girl quotes short,0,,,
soft girl quotes for instagram bio,0,,,
soft girl quotes pinterest,0,,,
soft girl quotes funny,0,,,
soft girl quotes aesthetic,0,,,
soft girl aesthetic quotes short,0,,,
aesthetic soft girl captions for instagram,0,,,
soft aesthetic captions for instagram,0,,,
aesthetic quotes about girl,0,,,
aesthetic summer girl photo,0,,,
cute aesthetic summer photos girl,0,,,
aesthetic summer ideas,0,,,
summer aesthetic name,0,,,
types of summer aesthetics,0,,,
aesthetic summer ideas with friends,0,,,
aesthetic summer activities,0,,,
aesthetic summer drawing ideas,0,,,
aesthetic summer outfit ideas,0,,,
aesthetic summer bracelet ideas,0,,,
aesthetic summer drawing ideas pinterest,0,,,
aesthetic summer painting ideas,0,,,
aesthetic summer nail ideas,0,,,
aesthetic summer photo ideas,0,,,
summer portrait ideas,0,,,
cool portrait ideas,0,,,
aesthetic art ideas easy,0,,,
aesthetic photography ideas at home,0,,,
aesthetic photoshoot ideas at home,0,,,
aesthetic photo ideas,0,,,
aesthetic picture ideas at home,0,,,
cool photography ideas,0,,,
aesthetic summer outfits girl pinterest,0,,,
cute baby girl names aesthetic,0,,,
what is the cutest aesthetic,0,,,
girl photography ideas,0,,,
girl photography ideas at home,0,,,
girl photo ideas,0,,,
girl photo ideas pinterest,0,,,
girl photo ideas for instagram,0,,,
girl photo ideas at home,0,,,
girl photo ideas for friends,0,,,
girl photo ideas for best friend,0,,,
girls photo ideas pose,0,,,
girls photo ideas simple,0,,,
name ideas for girl aesthetic,0,,,
tiktok name for girl aesthetic,0,,,
ml name for girl aesthetic,0,,,
roblox name for girl aesthetic,0,,,
mlbb name for girl aesthetic,0,,,
insta name for girl aesthetic,0,,,
instagram name for girl aesthetic,0,,,
id name for girl aesthetic,0,,,
game name for girl aesthetic,0,,,
for girls aesthetic photo,0,,,
summer aesthetic girl outfits,0,,,
summer girl aesthetic clothes,0,,,
summer beach girl aesthetic outfits,0,,,
summer clean girl aesthetic outfits,0,,,
summer cute aesthetic korean girl outfits,0,,,
brat girl summer aesthetic outfits,0,,,
hot girl summer aesthetic outfits,0,,,
downtown girl aesthetic summer outfits,0,,,
soft girl aesthetic summer outfits,0,,,
skater girl aesthetic outfits summer,0,,,
summer aesthetic girl pic,0,,,
summer pictures aesthetic girl,0,,,
summer aesthetic blonde girl beach pic,0,,,
hot girl summer aesthetic pics,0,,,
cute summer pictures aesthetic girl,0,,,
what is my summer aesthetic,0,,,
what does it mean when a girl says hot girl summer,0,,,
summer aesthetic names,0,,,
summer aesthetic playlist names,0,,,
italian summer aesthetic name,0,,,
summer girl aesthetic name,0,,,
different summer aesthetics names,0,,,
summer girl aesthetic outfits,0,,,
clean girl aesthetic clothes summer,0,,,
summer outfit ideas for 40 year old woman,0,,,
summer dress for 40 year old woman,0,,,
40 year old woman outfit ideas,0,,,
what should a 50 year old woman wear in the summer,0,,,
types of styles and aesthetics,0,,,
what are the different types of style aesthetics,0,,,
what is my summer aesthetic quiz,0,,,
what's your summer aesthetic,0,,,
what is the summer aesthetic called,0,,,
what is the summer aesthetic,0,,,
what is the brat summer aesthetic,0,,,
summer aesthetic words,0,,,
