keyword,trend_score,volume,cpc,competition
aesthetic uniform girl,0,,,
aesthetic school uniform girl,0,,,
aesthetic korean girl uniform,0,,,
how to dress aesthetic girl,0,,,
what is aesthetic outfits,0,,,
aesthetic uniform ideas,0,,,
aesthetic outfit ideas,0,,,
aesthetic outfit ideas female,0,,,
aesthetic costume ideas,0,,,
aesthetic outfit ideas pinterest,0,,,
aesthetic outfit ideas for girls,0,,,
aesthetic outfit ideas for school,0,,,
aesthetic outfit ideas drawing,0,,,
aesthetic outfit ideas for men,0,,,
aesthetic outfit ideas male,0,,,
aesthetic outfit pic ideas,0,,,
aesthetic photo ideas,0,,,
what makes a picture aesthetic,0,,,
aesthetic photo editing ideas,0,,,
aesthetic photoshoot ideas at home,0,,,
aesthetic uniform male,0,,,
aesthetic uniform men,0,,,
aesthetic school uniform male,0,,,
what is my clothing aesthetic male,0,,,
types of men's fashion aesthetics,0,,,
aesthetic uniform outfits,0,,,
aesthetic uniform dress,0,,,
aesthetic school uniform outfits,0,,,
how to wear aesthetic clothes,0,,,
aesthetic uniform school,0,,,
aesthetic school uniform ideas,0,,,
aesthetic school uniform pinterest,0,,,
aesthetic school uniform drawing,0,,,
aesthetic school uniform boy,0,,,
aesthetic college uniform,0,,,
aesthetic korean school uniform,0,,,
aesthetician uniform,0,,,
medical aesthetician uniform,0,,,
what is the aesthetician,0,,,
painter uniform woman,0,,,
pilot uniform woman,0,,,
pilot uniform female,0,,,
pilot uniform girl,0,,,
pilot uniform girl india,0,,,
pilot uniform girl pakistan,0,,,
pilot uniform female philippines,0,,,
pilot uniform female india,0,,,
pilot uniform girl in nigeria,0,,,
pilot uniform female price,0,,,
pilot uniform female drawing,0,,,
police uniform woman,0,,,
police uniform woman uk,0,,,
police woman uniform philippines,0,,,
police woman uniform skirt,0,,,
police woman uniform drawing,0,,,
police woman uniform in south africa,0,,,
police woman uniform png,0,,,
police woman uniform edit,0,,,
police woman uniform for kids,0,,,
police woman uniform in jamaica,0,,,
police woman uniform picture,0,,,
police uniform girl photo,0,,,
police uniform ladies photos,0,,,
up police uniform girl photo,0,,,
delhi police uniform girl photo,0,,,
what do female police officers wear,0,,,
unified modeling language,0,,,
unified modeling language (uml),0,,,
unified model,0,,,
unified modeling language in software engineering,0,,,
unified modeling language example,0,,,
unified modeling language (uml) diagrams,0,,,
unified model in software engineering,0,,,
unified model for multimodal understanding and generation,0,,,
unified model of agn,0,,,
unified modeling language diagram,0,,,
unified model of aesthetics,0,,,
what is unified data model,0,,,
aesthetic values dimension of community,0,,,
unified model for multimodal understanding and generation bagel,0,,,
a unified video and language pre training model for multimodal understanding and generation,0,,,
univl a unified video and language pre training model for multimodal understanding and generation,0,,,
unified reward model for multimodal understanding and generation,0,,,
unified multimodal understanding and generation models advances,0,,,
unified model meaning,0,,,
unified model of advocacy practice,0,,,
unified model of advocacy practice in social work,0,,,
unified model of advocacy practice steps,0,,,
unified model of advocacy practice in social work steps,0,,,
hoefer's unified model of advocacy practice,0,,,
what are the models of advocacy,0,,,
unified model of active galactic nuclei,0,,,
unified data model example,0,,,
unified modeling language pdf,0,,,
unified modeling language adalah,0,,,
unified modeling language meaning,0,,,
unified modeling language class diagram,0,,,
unified modeling language (uml) example,0,,,
unified modeling language (uml) pdf,0,,,
unified modeling language uml tools,0,,,
unified modeling language uml activity diagrams,0,,,
unified modeling language uml class diagram,0,,,
unified modeling language uml in software engineering,0,,,
unified modeling language uml phases,0,,,
unified modeling language uml 2.5,0,,,
unified modeling language uml diagrams geeksforgeeks,0,,,
unified modeling language uml class diagrams,0,,,
sequence diagram - unified modeling language (uml),0,,,
unified modeling language use case diagram,0,,,
unified modeling language sequence diagram,0,,,
unified modeling language uml use case diagram,0,,,
in unified modeling language uml class diagrams a class is represented by a rectangle,0,,,
in unified modeling language uml class diagrams associations are represented by dashed lines,0,,,
unified modeling language diagram example,0,,,
unified modeling language uml ) complete guide & examples,0,,,
explain unified modeling language,0,,,
what is unified modeling language,0,,,
unified modeling language specification,0,,,
uniform aesthetic,0,,,
uniform aesthetic pinterest,0,,,
uniform aesthetic meaning,0,,,
uniform aesthetic name,0,,,
aesthetic meaning in clothing,0,,,
what is my aesthetic name,0,,,
school uniform aesthetic pinterest,0,,,
aesthetic pinterest outfit ideas,0,,,
what is my aesthetic clothing,0,,,
uniform fashions photos,0,,,
uniform style photo,0,,,
fashion uniforms photos,0,,,
clothes uniform photos,0,,,
bombay fashion uniform photos,0,,,
vicky's school uniform & fashion photos,0,,,
uniform and fashion district photos,0,,,
uniform style meaning,0,,,
uniforms & fashions glasgow photos,0,,,
uniform models,0,,,
uniform models for girls,0,,,
uniform models for kids,0,,,
uniform models for college girls,0,,,
uniform models for college,0,,,
uniform models for office,0,,,
uniform models for ladies,0,,,
uniform models for hospital,0,,,
uniform models for boys,0,,,
uniform models for women,0,,,
uniform models photos,0,,,
uniform coat model photos,0,,,
school uniform models photos,0,,,
amrita school uniform model photos,0,,,
amrita vidyalayam uniform model photos,0,,,
uniform photoshoot ideas,0,,,
what is photo modeling,0,,,
uniform model statistics,0,,,
uniform model stats,0,,,
uniform data model,0,,,
uniform photo caption,0,,,
dress photo caption,0,,,
dress photo caption for instagram,0,,,
school uniform photo caption,0,,,
college uniform photo caption,0,,,
police uniform photo caption,0,,,
ncc uniform photo caption,0,,,
what is a photo caption examples,0,,,
uniform photo editor online free,0,,,
uniform photo editor,0,,,
uniform photo editor online,0,,,
uniform photo editor free,0,,,
uniform photo editor app,0,,,
dress photo editor,0,,,
dress photo editor online free,0,,,
dress photo editor online,0,,,
dress photo editor app,0,,,
police uniform photo editor online,0,,,
school uniform photo editor online,0,,,
army uniform photo editor online,0,,,
seaman uniform photo editor online free,0,,,
pilot uniform photo editor online,0,,,
police uniform photo editor online india,0,,,
uniform photo of lucknow polytechnic lucknow,0,,,
uniform photo pose,0,,,
uniform photo pose girl,0,,,
uniform photo pose boy,0,,,
dress photo pose,0,,,
dress photo pose girl,0,,,
dress photo pose girl simple,0,,,
dress photo pose girl indian,0,,,
dress photo poses girl standing,0,,,
dress photo pose girl simple indian,0,,,
dress photo poses female,0,,,
dress photo pose girl simple for instagram,0,,,
dress photo poses girl standing simple,0,,,
college uniform photo pose girl,0,,,
police uniform photo pose girl,0,,,
uniform photography,0,,,
uniform requirements citation style,0,,,
uniform portrait pictures,0,,,
portrait photography description,0,,,
portrait photography examples,0,,,
portrait photography definition,0,,,
uniform photos,0,,,
uniform photoshoot,0,,,
pilot uniform photos,0,,,
driver uniform photos,0,,,
school uniform photos,0,,,
security uniform photos,0,,,
kdf uniform photos,0,,,
uniform craft photos,0,,,
cms uniform photos,0,,,
what is a portrait style picture,0,,,
what to wear for portrait pictures,0,,,
portrait photo example,0,,,
can a portrait be a photo,0,,,
uniform photoshoot girl,0,,,
school uniform photoshoot,0,,,
school uniform photoshoot ideas,0,,,
police uniform photoshoot,0,,,
korean uniform photoshoot,0,,,
army uniform photoshoot,0,,,
military uniform photoshoot,0,,,
navy uniform photoshoot,0,,,
uniform styles,0,,,
uniform style for girls,0,,,
uniform styles for nurses,0,,,
uniform style pants,0,,,
uniform style for teachers,0,,,
uniform styles for school,0,,,
uniform styles for ladies,0,,,
uniform style dress,0,,,
uniform style shorts,0,,,
uniform style for women,0,,,
style uniform examples,0,,,
different portrait styles,0,,,
what is portrait style,0,,,
style uniform ideas,0,,,
uniform style tailoring photos,0,,,
what is style in photography,0,,,
uniform style body armor,0,,,
uniform style fashion,0,,,
uniform style clothes,0,,,
school uniform style fashion,0,,,
school uniform fashion style for girl,0,,,
uniform style outer carrier,0,,,
uniform style pants women,0,,,
black uniform style pants,0,,,
school uniform style pants,0,,,
uniform style work pants,0,,,
traditional uniform style pants,0,,,
uniform style khaki pants,0,,,
men's uniform style pants,0,,,
navy uniform style pants,0,,,
uniform style plate carrier,0,,,
uniform style vest carrier,0,,,
uniform styles for boys,0,,,
school uniform styles for boys,0,,,
uniform styles for kids,0,,,
school uniform design for boys and girls,0,,,
uniform styles for girls,0,,,
uniform design for girls,0,,,
uniform design for girls college,0,,,
school uniform styles for girls,0,,,
college uniform style for girls,0,,,
high school uniform styles for girls,0,,,
school uniform design for girls,0,,,
uniform coat design for girls,0,,,
school uniform design for girls suit,0,,,
uniform woman john paul richard,0,,,
uniform woman,0,,,
uniform woman school,0,,,
woman uniform pants,0,,,
uniform girl photo,0,,,
girl uniform photo pose,0,,,
uniform girl aesthetic,0,,,
uniform woman john paul richard leather jacket,0,,,
uniform woman john paul richard leather,0,,,
uniform girl school,0,,,
uniform girl school socks,0,,,
uniform school girl drawing,0,,,
girl uniform school dress,0,,,
uniform school girl clipart,0,,,
girl uniform school shoes,0,,,
uniform school girl uk,0,,,
uniform school girl photo,0,,,
